{
  "from": {
    "height": 1536,
    "image_sha256": "5134b12da062f5f204c7f4913a2f2a667056035939d823c023993c67d16dc955",
    "prompt": "Vertical mobile game background art: a quiet enchanted forest clearing, deep green moss and ferns, tall dark tree trunks framing the edges, soft dark vignette around the borders, a gentle pool of warm glowing light in the centre, floating golden sparkles, painterly stylized 3D look, strong depth of field with a blurred distance, simple and uncluttered, no mushrooms, no characters, no text, no logo, no letters",
    "run": "out/gen/runs/concept_zimage-7f38de2337c1",
    "run_id": "concept_zimage-7f38de2337c1",
    "seed": 11,
    "width": 864,
    "workflow": "concept_zimage"
  },
  "kind": "generated",
  "licence": "generated",
  "models": [
    {
      "id": "birefnet",
      "licence": "MIT",
      "sha256": "9ab37426bf4de0567af6b5d21b16151357149139362e6e8992021b8ce356a154"
    },
    {
      "id": "qwen3_4b_fp8",
      "licence": "Apache-2.0",
      "sha256": "72450b19758172c5a7273cf7de729d1c17e7f434a104a00167624cba94f68f15"
    },
    {
      "id": "z_image_turbo_int8",
      "licence": "Apache-2.0",
      "sha256": "be517ebd47c912a5626a588e1aeea43e6be4a43c0cdcd2b48a2a780d9f358635"
    },
    {
      "id": "z_image_vae",
      "licence": "Apache-2.0",
      "sha256": "afc8e28272cd15db3919bacdb6918ce9c1ed22e96cb12c4d5ed0fba823529e38"
    }
  ],
  "output": "background.png",
  "output_sha256": "5134b12da062f5f204c7f4913a2f2a667056035939d823c023993c67d16dc955",
  "schema_version": "1.0",
  "slot": "background",
  "tool": "artpipe.banners.art"
}
